cluster_id,fact_count,sample_count,percentage_of_samples,avg_attention_score,std_attention_score,avg_sentiment,std_sentiment,sample_event_types
41,4,4,2.105263,0.38539,0.106347,0.575,0.248747,artificial_intelligence_adoption; investment_in_ai; investment_in_artificial_intelligence
25,31,28,14.736842,0.330533,0.314512,-0.535484,0.328779,consumer_spending_decrease; economic_downturn; industry_slowdown; market_decline; market_plunge
36,28,23,12.105263,0.303776,0.293156,0.285714,0.447784,asset_divestiture; asset_sale; divestment; divesture; equity_raising
49,17,14,7.368421,0.293346,0.271574,-0.458824,0.42573,brexit_impact; export_restrictions; geopolitical_event; geopolitical_risk; geopolitical_tensions
5,14,13,6.842105,0.2648,0.213452,0.078571,0.534761,demand_supply_mismatch; production_challenges; production_milestone; production_miss; supply_agreement
43,18,10,5.263158,0.25701,0.153296,0.416667,0.567891,economic_stimulus; government_incentives; government_initiative; government_subsidy; legislative_support
45,13,8,4.210526,0.247758,0.298427,0.307692,0.666173,fund_launch; innovation_hub_opening; menu_launch; new_exchange_launch; promotion_launch
26,15,12,6.315789,0.236624,0.240849,0.06,0.471593,bankruptcy; bond_issuance; bond_issue; bond_sale; debt_analysis
21,16,14,7.368421,0.229354,0.25603,-0.33125,0.49714,advertising_pause; business_setback; company_response; contract_loss; customer_loss
13,29,13,6.842105,0.205536,0.26607,-0.531034,0.439517,counterfeiting_scheme; court_ruling; dispute_resolution; human_rights_hearing; intellectual_property_dispute
8,12,5,2.631579,0.193713,0.253859,-0.05,0.606218,flexible_work_arrangements; labor_agreement; labor_dispute; labor_negotiations; wage_increase
38,91,49,25.789474,0.190927,0.237448,0.471429,0.345786,bearish_outlook; economic_forecast; economic_outlook; investment_outlook; long_term_outlook
57,27,23,12.105263,0.18733,0.215192,0.474074,0.351286,business_restart; business_restart_plan; business_restructuring; business_resumption; business_strategy_shift
14,38,25,13.157895,0.185623,0.234293,0.268421,0.449623,acquisition_rumor; acquisition_rumors; company_breakup; company_controversy; divestiture
28,35,21,11.052632,0.180858,0.302914,0.571429,0.291373,analyst_rating; customer_loyalty_ranking; guru_rating; investment_rating; neutral_rating
56,3,1,0.526316,0.179311,0.033981,0.6,0.141421,banking_sector_stability; banking_system_support
55,96,40,21.052632,0.178715,0.242024,0.244792,0.418547,regulatory_action; regulatory_announcement; regulatory_approval; regulatory_call; regulatory_challenge
31,22,19,10.0,0.17402,0.225149,0.440909,0.524542,after_hours_trading; bullish_trade; insider_buying; oversold_condition; pre_market_trading
20,34,30,15.789474,0.170413,0.140621,0.564706,0.251913,adoption_expansion; benefit_expansion; business_expansion; business_model_expansion; delivery_expansion
19,20,14,7.368421,0.149685,0.222818,0.67,0.205183,business_recovery; economic_recovery; market_rebound; market_recovery; recovery
7,14,14,7.368421,0.14628,0.110383,0.507143,0.347366,automation_adoption; digital_innovation; digital_transformation; disruption_and_innovation; menu_innovation
29,205,74,38.947368,0.14312,0.222976,0.709024,0.168939,brand_performance; brand_recognition; counterfeit_product_removal; product_adoption; product_demand
12,8,7,3.684211,0.13807,0.086667,0.5,0.466369,climate_risk_disclosure; green_bond_issuance; renewable_energy_commitment; renewable_energy_initiative; renewable_energy_trend
23,76,48,25.263158,0.136897,0.177974,0.394737,0.426088,businessSuspension; business_delegation; business_failure; business_model; business_model_analysis
3,23,15,7.894737,0.134173,0.123184,0.578261,0.419064,demand_surge; holiday_sales; holiday_sales_report; holiday_season_sales; new_purchase
11,12,10,5.263158,0.130095,0.143459,0.533333,0.46428,auction; bond_offering; contract_award; contract_ratification; contract_win
18,15,11,5.789474,0.129988,0.129122,0.433333,0.433077,cloud_competition; cloud_computing_strategy; cryptocurrency_adoption; cryptocurrency_backing; custom_chip_development
30,12,7,3.684211,0.122882,0.096843,0.325,0.635249,covid_19_impact; health_crisis_impact; pandemic_impact; pandemic_recovery; pandemic_related_decline
27,39,8,4.210526,0.11767,0.246872,0.3,0.337411,index_composition; index_construction; index_inclusion; index_movement; market_index_movement
33,153,43,22.631579,0.114625,0.256687,0.529085,0.460627,added_position; added_positions; blue_chip_classification; breakout; cloud_transition
0,107,61,32.105263,0.113033,0.184808,0.769626,0.162308,business_growth; cloud_services_growth; company_growth; customer_growth; expansion_and_growth
47,104,36,18.947368,0.111169,0.182435,0.251923,0.326102,executive_expectations_and_valuation; industry_valuation; market_valuation; stock_valuation; undervaluation
16,90,17,8.947368,0.109455,0.271825,0.433333,0.354338,capital_increase_approval; capital_plan_approval; capital_raise_consideration; cash_reserve; construction_spending_increase
1,525,90,47.368421,0.105155,0.240376,0.347048,0.237639,comparable_analysis; comparative_analysis; comparison; competitive_benchmarking; competitive_comparison
42,99,34,17.894737,0.1035,0.211879,-0.149495,0.522692,investment_and_partnership; partnership_acquisition; partnership_and_certifications; partnership_and_competition; partnership_and_expansion
24,96,22,11.578947,0.099635,0.217007,0.128125,0.332824,currency_headwinds; economic_commentary; economic_policy_impact; federal_reserve_announcement; federal_reserve_intervention
46,67,20,10.526316,0.090445,0.231049,0.601493,0.350902,profit_margin_increase; profitability_outlook; reduced_profit_forecast; revenue_forecast; revenue_growth
51,680,88,46.315789,0.087191,0.180564,-0.283088,0.393692,competition; competition_analysis; competition_and_privacy_changes; competition_expansion; competition_intensification
6,557,68,35.789474,0.081007,0.215245,0.382944,0.23457,business_update_and_dividend_growth; dividend_adjustment; dividend_announcement; dividend_announcement_and_share_repurchase; dividend_comparison
9,289,88,46.315789,0.07379,0.142945,-0.020415,0.769149,earnings_analysis; earnings_and_demand_update; earnings_and_financials; earnings_and_rating_upgrade; earnings_beat
59,1604,92,48.421053,0.066378,0.219228,-0.006827,0.313015,etf_analysis; etf_comparison; etf_composition; etf_description; etf_focus
2,1588,120,63.157895,0.066224,0.18687,0.579534,0.202417,blockchain_partnership; collaboration; industry_partnership; investment_partnership; partnership
40,304,40,21.052632,0.05716,0.187147,-0.241118,0.429029,asset_management_update; asset_under_management_update; assets_under_management_update; brokerage_update; brokerage_upgrade
15,526,71,37.368421,0.057035,0.158862,0.561977,0.195187,acquisition; acquisition_and_dividend; acquisition_and_expansion; acquisition_and_partnership; acquisition_and_restructuring
17,1410,151,79.473684,0.055813,0.15119,0.366418,0.395823,acquisition_and_earnings_announcement; earnings_and_sales_report; earnings_announcement; earnings_announcement_and_acquisition; earnings_announcement_and_deal_uncertainty
32,866,106,55.789474,0.054506,0.169478,0.383487,0.522069,avoidance_of_stocks; cyclical_stock_analysis; financial_analysis; former_penny_stocks; growth_stock_analysis
22,280,32,16.842105,0.052358,0.170314,0.495357,0.275577,ceo_appointment; executive_appointment; executive_background; executive_change; executive_commentary
37,413,51,26.842105,0.05067,0.177149,0.421065,0.300632,competitive_jab; congressional_hearing; crisis_management; criticism; election_aftermath
10,1767,87,45.789474,0.046249,0.181742,0.246123,0.386729,analyst_comment; analyst_commentary; analyst_coverage; analyst_coverage_initiation; analyst_downgrade
34,2550,125,65.789474,0.042197,0.151802,0.236843,0.430773,industrial_policy; industry_analysis; industry_challenges; industry_concerns; industry_context
58,61,13,6.842105,0.039072,0.139328,0.465574,0.270934,catastrophe_loss_report; economic_data_release; fee_income_report; industry_loss_report; market_share_report
53,4169,154,81.052632,0.039049,0.149676,0.527649,0.431593,cryptocurrency_market_fluctuation; cryptocurrency_market_movement; cryptocurrency_price_movement; market_analysis; market_commentary
54,89,5,2.631579,0.038058,0.157189,0.14382,0.227322,credit_agreement; credit_card_promotion; credit_card_switch; credit_quality_concerns; credit_rating_change
48,330,17,8.947368,0.031754,0.151272,0.437576,0.255687,initial_public_offering; ipo_announcement; ipo_funding; ipo_impact; ipo_investment
44,13,11,5.789474,0.02589,0.032765,0.430769,0.126398,high_options_trading_volume; options_contract_availability; options_contract_update; options_trading; options_trading_activity
4,3404,106,55.789474,0.025718,0.125527,0.338763,0.476376,activist_investor; alternative_investment; competitive_investment; cryptocurrency_investment; esg_investing
35,22,2,1.052632,0.023289,0.106722,0.590909,0.04166,licensing_agreement
52,455,11,5.789474,0.01448,0.104341,0.393407,0.335255,catastrophe_loss_estimate; data_security_concerns; health_and_safety_measures; health_concerns; insurance_claims_improvement
50,1613,25,13.157895,0.006161,0.061065,0.878425,0.092861,adoption; award_or_recognition; award_recognition; conference_discussion; conference_participation
39,722,11,5.789474,0.003652,0.053107,0.101662,0.076795,labor_cost_increase; price_drop; price_target; price_target_increase; price_target_raise
