cluster_id,fact_count,cluster_proportion,avg_attention_score,std_attention_score,weighted_attention_score,avg_sentiment,std_sentiment,sample_event_types
53,4172,0.160957,0.039054,0.14959,0.006286,0.527953,0.431301,cryptocurrency_market_fluctuation; cryptocurrency_market_movement; cryptocurrency_price_movement; market_analysis; market_commentary
34,2548,0.098302,0.042332,0.152439,0.004161,0.23748,0.430167,industrial_policy; industry_analysis; industry_challenges; industry_concerns; industry_context
59,1608,0.062037,0.066006,0.218247,0.004095,-0.005317,0.314242,etf_analysis; etf_comparison; etf_composition; etf_description; etf_focus
2,1589,0.061304,0.065497,0.186218,0.004015,0.589081,0.206278,blockchain_partnership; industry_partnership; investment_partnership; partnership; partnership_and_industry_challenges
4,3347,0.129128,0.026132,0.127157,0.003374,0.33899,0.479454,activist_investor; alternative_investment; cryptocurrency_investment; esg_investing; hedge_fund_positioning
10,1795,0.069252,0.045467,0.180263,0.003149,0.250084,0.384974,analyst_comment; analyst_commentary; analyst_coverage; analyst_coverage_initiation; analyst_downgrade
17,1393,0.053742,0.055593,0.152743,0.002988,0.362699,0.39561,acquisition_and_earnings_announcement; earnings_and_sales_report; earnings_announcement; earnings_announcement_and_acquisition; earnings_announcement_and_deal_uncertainty
51,690,0.02662,0.087325,0.17919,0.002325,-0.274348,0.397813,competition; competition_analysis; competition_and_privacy_changes; competition_intensification; competition_performance
1,602,0.023225,0.093431,0.227086,0.00217,0.330399,0.230822,comparable_analysis; comparative_analysis; comparison; competitive_benchmarking; competitive_comparison
32,871,0.033603,0.055259,0.169033,0.001857,0.387486,0.519177,cyclical_stock_analysis; financial_analysis; former_penny_stocks; growth_stock_analysis; growth_stock_evaluation
6,554,0.021373,0.080833,0.215776,0.001728,0.381047,0.233522,business_update_and_dividend_growth; dividend_adjustment; dividend_analysis; dividend_announcement; dividend_announcement_and_share_repurchase
15,528,0.02037,0.056423,0.157354,0.001149,0.567235,0.186084,acquisition; acquisition_and_dividend; acquisition_and_expansion; acquisition_and_partnership; acquisition_and_restructuring
29,201,0.007755,0.141323,0.223424,0.001096,0.710945,0.165282,brand_performance; brand_recognition; counterfeit_product_removal; product_adoption; product_demand
9,294,0.011343,0.074209,0.14262,0.000842,-0.010034,0.766281,acquisitions_and_earnings_growth; earnings_analysis; earnings_and_demand_update; earnings_and_financials; earnings_and_rating_upgrade
37,417,0.016088,0.051137,0.176512,0.000823,0.421103,0.296237,competitive_jab; congressional_hearing; crisis_management; criticism; election_aftermath
33,155,0.00598,0.114906,0.254932,0.000687,0.53,0.457715,added_position; added_positions; blue_chip_classification; breakout; cloud_transition
55,112,0.004321,0.154694,0.236838,0.000668,0.166964,0.412178,regulatory_action; regulatory_announcement; regulatory_approval; regulatory_call; regulatory_challenge
38,88,0.003395,0.195832,0.240745,0.000665,0.485227,0.324839,economic_forecast; economic_outlook; investment_outlook; long_term_outlook; market_cap_projection
40,301,0.011613,0.056008,0.187521,0.00065,-0.245183,0.429345,asset_management_update; asset_under_management_update; assets_under_management_update; brokerage_update; brokerage_upgrade
22,279,0.010764,0.052303,0.170588,0.000563,0.49319,0.274855,ceo_appointment; executive_appointment; executive_background; executive_change; executive_commentary
47,110,0.004244,0.109884,0.178147,0.000466,0.273636,0.341302,executive_expectations_and_valuation; market_valuation; stock_valuation; undervaluation; undervaluation_analysis
0,103,0.003974,0.116707,0.188631,0.000464,0.767961,0.166759,business_growth; company_growth; customer_growth; expansion_and_growth; growth_acceleration
48,331,0.01277,0.031873,0.150872,0.000407,0.439275,0.255392,initial_public_offering; ipo_announcement; ipo_arrangement; ipo_funding; ipo_impact
16,92,0.003549,0.114065,0.27241,0.000405,0.432609,0.351738,capital_increase_approval; capital_plan_announcement; capital_plan_approval; capital_raise_consideration; cash_reserve
42,99,0.003819,0.103244,0.211459,0.000394,-0.152525,0.518027,investment_and_partnership; partnership_acquisition; partnership_and_certifications; partnership_and_competition; partnership_and_expansion
23,72,0.002778,0.141492,0.184116,0.000393,0.372222,0.426622,businessSuspension; business_delegation; business_failure; business_model; business_model_analysis
25,31,0.001196,0.325461,0.316773,0.000389,-0.53871,0.329885,consumer_spending_decrease; economic_downturn; industry_slowdown; market_decline; market_plunge
50,1614,0.062269,0.006176,0.061057,0.000385,0.878005,0.094355,adoption; award_or_recognition; award_recognition; conference_discussion; conference_participation
24,95,0.003665,0.099705,0.218932,0.000365,0.131579,0.313977,currency_headwinds; economic_commentary; federal_reserve_announcement; federal_reserve_intervention; federal_reserve_policy
36,32,0.001235,0.270904,0.282194,0.000334,0.3625,0.428478,asset_divestiture; asset_sale; buyout_interest; divestment; divesture
14,37,0.001427,0.190111,0.236555,0.000271,0.281081,0.465477,acquisition_rumor; acquisition_rumors; company_breakup; company_controversy; divestiture
28,40,0.001543,0.168063,0.284231,0.000259,0.5725,0.333157,analyst_rating; customer_loyalty_ranking; guru_rating; investment_rating; neutral_rating
52,453,0.017477,0.014169,0.103993,0.000248,0.395364,0.332693,catastrophe_loss_estimate; data_security_concerns; insurance_claims_improvement; natural_disaster; natural_disaster_impact
13,31,0.001196,0.202492,0.258341,0.000242,-0.477419,0.464001,antitrust_investigation_closure; counterfeiting_scheme; court_ruling; dispute_resolution; human_rights_hearing
46,65,0.002508,0.091235,0.23334,0.000229,0.621538,0.322725,profit_margin_increase; profitability_outlook; reduced_profit_forecast; revenue_estimate; revenue_forecast
20,36,0.001389,0.161271,0.139475,0.000224,0.572222,0.247892,adoption_expansion; benefit_expansion; business_expansion; business_model_expansion; delivery_expansion
57,26,0.001003,0.189785,0.21367,0.00019,0.457692,0.34771,business_restart; business_restart_plan; business_restructuring; business_resumption; business_strategy_shift
49,17,0.000656,0.287505,0.26338,0.000189,-0.458824,0.42573,brexit_impact; export_restrictions; geopolitical_event; geopolitical_risk; geopolitical_tensions
27,17,0.000656,0.264525,0.307212,0.000173,0.558824,0.377389,index_composition; index_construction; index_inclusion; index_movement; market_index_movement
43,16,0.000617,0.27162,0.157722,0.000168,0.56875,0.393254,economic_stimulus; government_incentives; government_initiative; government_subsidy; legislative_support
31,21,0.00081,0.179576,0.230023,0.000145,0.42381,0.526357,after_hours_trading; bullish_trade; insider_buying; oversold_condition; pre_market_trading
26,16,0.000617,0.233162,0.237796,0.000144,0.0125,0.489738,bankruptcy; bond_issuance; bond_issue; bond_sale; debt_analysis
5,12,0.000463,0.292469,0.224077,0.000135,0.158333,0.536126,demand_supply_mismatch; production_challenges; production_milestone; production_miss; supply_agreement
21,15,0.000579,0.227939,0.259251,0.000132,-0.306667,0.50394,advertising_pause; business_setback; company_response; contract_loss; customer_loss
54,89,0.003434,0.037762,0.156855,0.00013,0.14382,0.227322,credit_agreement; credit_card_promotion; credit_card_switch; credit_quality_concerns; credit_rating_change
45,12,0.000463,0.262054,0.30647,0.000121,0.266667,0.677413,fund_launch; innovation_hub_opening; new_exchange_launch; promotion_launch; spin_off_announcement
3,21,0.00081,0.138918,0.126103,0.000113,0.561905,0.43477,demand_surge; holiday_sales; holiday_sales_report; holiday_season_sales; new_purchase
19,18,0.000694,0.15813,0.233437,0.00011,0.672222,0.210305,business_recovery; economic_recovery; market_rebound; market_recovery; recovery_potential
39,722,0.027855,0.003665,0.053134,0.000102,0.101662,0.076795,labor_cost_increase; price_drop; price_movement; price_target; price_target_increase
8,12,0.000463,0.199718,0.254568,9.2e-05,-0.041667,0.617061,flexible_work_arrangements; labor_agreement; labor_contract_agreement; labor_dispute; labor_negotiations
58,34,0.001312,0.069939,0.180505,9.2e-05,0.441176,0.363899,catastrophe_loss_report; economic_data_release; industry_loss_report; market_share_report; portfolio_disclosure
7,14,0.00054,0.149851,0.112148,8.1e-05,0.507143,0.347366,automation_adoption; digital_innovation; digital_technology_success; digital_transformation; disruption_and_innovation
18,16,0.000617,0.121696,0.114347,7.5e-05,0.45625,0.428615,big_data_focus; cloud_competition; cloud_computing_strategy; cryptocurrency_adoption; cryptocurrency_backing
30,13,0.000502,0.120438,0.100948,6e-05,0.369231,0.629267,covid_19_impact; health_crisis_impact; pandemic_growth; pandemic_impact; pandemic_recovery
41,4,0.000154,0.382875,0.104774,5.9e-05,0.575,0.248747,artificial_intelligence_adoption; investment_in_ai; investment_in_artificial_intelligence
11,10,0.000386,0.139264,0.152693,5.4e-05,0.49,0.49689,auction; bond_offering; contract_ratification; deal_cancellation; new_deals
12,8,0.000309,0.14071,0.085001,4.3e-05,0.5,0.466369,climate_risk_disclosure; green_bond_issuance; renewable_energy_commitment; renewable_energy_initiative; renewable_energy_trend
56,7,0.00027,0.121387,0.059185,3.3e-05,0.442857,0.184059,banking_sector_stability; banking_sector_update; banking_system_support; deposit_trends
35,2,7.7e-05,0.244264,0.244264,1.9e-05,0.5,0.1,licensing_agreement
44,13,0.000502,0.025697,0.032517,1.3e-05,0.430769,0.126398,high_options_trading_volume; options_contract_availability; options_contract_update; options_trading; options_trading_activity
