cluster_id,fact_count,sample_count,percentage_of_samples,avg_attention_score,std_attention_score,avg_sentiment,std_sentiment,sample_event_types
41,5,4,2.105263,0.376781,0.109597,0.62,0.24,ai_revolution; artificial_intelligence_adoption; investment_in_ai; investment_in_artificial_intelligence
49,15,13,6.842105,0.311332,0.27313,-0.433333,0.443722,brexit_impact; export_restrictions; geopolitical_event; geopolitical_risk; geopolitical_tensions
25,33,29,15.263158,0.309213,0.311492,-0.539394,0.31998,consumer_spending_decrease; economic_downturn; housing_start_decline; industry_slowdown; market_decline
43,15,8,4.210526,0.283484,0.152899,0.566667,0.406065,government_incentives; government_initiative; government_subsidy; legislative_support; meeting_with_government
45,11,6,3.157895,0.281354,0.31227,0.236364,0.699705,innovation_hub_opening; new_exchange_launch; promotion_launch; spin_off_announcement
36,32,25,13.157895,0.274399,0.278826,0.340625,0.445014,asset_divestiture; asset_sale; buyout_interest; divestment; divesture
21,12,10,5.263158,0.271259,0.280983,-0.233333,0.534374,advertising_pause; company_response; contract_loss; customer_loss; operations_resumption
5,15,13,6.842105,0.253979,0.22171,0.126667,0.547073,demand_supply_mismatch; production_challenges; production_milestone; production_miss; supplier_change
26,15,12,6.315789,0.238607,0.244467,-0.006667,0.466857,bankruptcy; bond_issuance; bond_issue; bond_sale; debt_analysis
13,27,14,7.368421,0.220406,0.271931,-0.459259,0.485538,antitrust_investigation_closure; counterfeiting_scheme; court_ruling; dispute_resolution; human_rights_hearing
38,92,50,26.315789,0.190005,0.235679,0.492391,0.32032,economic_forecast; economic_outlook; investment_outlook; long_term_outlook; market_cap_projection
14,38,23,12.105263,0.187489,0.234898,0.323684,0.4504,acquisition_rumor; acquisition_rumors; company_breakup; company_controversy; divestiture
8,13,6,3.157895,0.185816,0.245386,-0.076923,0.605302,flexible_work_arrangements; labor_agreement; labor_contract_agreement; labor_dispute; labor_negotiations
57,26,23,12.105263,0.184716,0.211956,0.45,0.345576,business_restart; business_restart_plan; business_restructuring; business_resumption; business_strategy_shift
55,97,39,20.526316,0.184628,0.246875,0.230928,0.419219,regulatory_action; regulatory_announcement; regulatory_approval; regulatory_call; regulatory_challenge
12,5,5,2.631579,0.176556,0.085682,0.76,0.08,green_bond_issuance; renewable_energy_initiative; renewable_energy_trend; sustainability_efforts; sustainability_initiative
28,40,25,13.157895,0.168584,0.287316,0.5625,0.329156,analyst_rating; brand_loyalty_ranking; customer_loyalty_ranking; guru_rating; investment_rating
31,24,20,10.526316,0.164568,0.218324,0.458333,0.507376,after_hours_trading; bullish_trade; insider_buying; oversold_condition; pre_market_trading
20,35,30,15.789474,0.162158,0.13714,0.588571,0.256093,adoption_expansion; benefit_expansion; business_expansion; business_model_expansion; delivery_expansion
19,20,15,7.894737,0.14884,0.224083,0.685,0.203162,business_recovery; economic_recovery; market_rebound; market_recovery; recovery
7,13,13,6.842105,0.1482,0.108468,0.5,0.353009,automation_adoption; digital_technology_success; digital_transformation; disruption_and_innovation; menu_innovation
0,87,58,30.526316,0.141868,0.197097,0.755172,0.184925,business_growth; cloud_services_growth; customer_growth; growth_acceleration; growth_and_dividend
56,5,2,1.052632,0.141761,0.062442,0.68,0.146969,bank_performance; banking_sector_stability; banking_system_support
29,208,74,38.947368,0.141572,0.222008,0.705288,0.1718,brand_performance; brand_recognition; counterfeit_product_removal; product_adoption; product_demand
3,22,14,7.368421,0.138833,0.130148,0.572727,0.427659,demand_surge; holiday_sales; holiday_sales_report; holiday_season_sales; new_purchase
23,74,46,24.210526,0.136535,0.179556,0.381081,0.423523,businessSuspension; business_delegation; business_failure; business_model; business_model_description
11,11,9,4.736842,0.131069,0.149925,0.509091,0.477597,auction; bond_offering; contract_award; contract_ratification; deal_cancellation
18,15,11,5.789474,0.127193,0.12273,0.433333,0.433077,cloud_competition; cloud_computing_strategy; cryptocurrency_adoption; cryptocurrency_backing; custom_chip_development
27,39,8,4.210526,0.117495,0.246638,0.3,0.337411,index_composition; index_construction; index_inclusion; index_movement; market_index_movement
16,90,17,8.947368,0.114238,0.27499,0.426667,0.353019,capital_increase_approval; capital_plan_approval; capital_raise_consideration; cash_reserve; efficiency_ratio_improvement
33,152,42,22.105263,0.113717,0.256569,0.526645,0.461153,added_position; added_positions; blue_chip_classification; breakout; cloud_transition
30,12,7,3.684211,0.113306,0.07891,0.333333,0.642045,covid_19_impact; health_crisis_impact; pandemic_growth; pandemic_impact; pandemic_recovery
47,106,39,20.526316,0.108549,0.180809,0.269811,0.327705,executive_expectations_and_valuation; market_valuation; stock_valuation; undervaluation; undervaluation_analysis
42,100,35,18.421053,0.104574,0.210028,-0.146,0.519504,investment_and_partnership; partnership_acquisition; partnership_and_certifications; partnership_and_competition; partnership_and_growth_prospects
24,97,24,12.631579,0.099018,0.215595,0.142268,0.319418,currency_headwinds; economic_commentary; economic_policy_impact; federal_reserve_announcement; federal_reserve_intervention
1,571,89,46.842105,0.095872,0.231822,0.335902,0.232831,comparable_analysis; comparative_analysis; comparison; competitive_benchmarking; competitive_comparison
46,66,19,10.0,0.091567,0.234032,0.595455,0.350511,profit_margin_increase; profitability_outlook; record_revenue_increase; reduced_profit_forecast; revenue_forecast
51,679,87,45.789474,0.086255,0.179841,-0.282032,0.394739,competition; competition_analysis; competition_and_privacy_changes; competition_expansion; competition_intensification
6,558,68,35.789474,0.079415,0.215189,0.391398,0.226073,business_update_and_dividend_growth; dividend_adjustment; dividend_analysis; dividend_announcement; dividend_announcement_and_share_repurchase
9,293,87,45.789474,0.073958,0.142905,-0.010068,0.767009,acquisitions_and_earnings_growth; earnings_analysis; earnings_and_demand_update; earnings_and_financials; earnings_and_rating_upgrade
58,32,12,6.315789,0.066865,0.185833,0.428125,0.369319,catastrophe_loss_report; customer_satisfaction_report; economic_data_release; industry_loss_report; portfolio_disclosure
59,1605,93,48.947368,0.066419,0.21924,-0.006262,0.313616,etf_analysis; etf_comparison; etf_composition; etf_description; etf_focus
2,1616,123,64.736842,0.065453,0.185449,0.578837,0.201903,blockchain_partnership; collaboration; industry_partnership; investment_partnership; partnership
40,304,39,20.526316,0.057861,0.18782,-0.244408,0.429161,asset_management_update; asset_under_management_update; assets_under_management_update; brokerage_update; brokerage_upgrade
15,518,70,36.842105,0.056369,0.159692,0.56139,0.187175,acquisition; acquisition_and_dividend; acquisition_and_expansion; acquisition_and_partnership; acquisition_and_restructuring
17,1409,151,79.473684,0.055562,0.151481,0.36753,0.394459,acquisition_and_earnings_announcement; earnings_and_sales_report; earnings_announcement; earnings_announcement_and_acquisition; earnings_announcement_and_deal_uncertainty
32,875,107,56.315789,0.054916,0.168488,0.3864,0.520251,avoidance_of_stocks; cyclical_stock_analysis; financial_analysis; former_penny_stocks; growth_stock_analysis
22,280,33,17.368421,0.051692,0.169522,0.495,0.275506,ceo_appointment; executive_appointment; executive_background; executive_change; executive_commentary
37,418,56,29.473684,0.0508,0.176028,0.4189,0.302939,competitive_jab; confidence_vote; congressional_hearing; crisis_management; criticism
10,1764,84,44.210526,0.045928,0.18155,0.246032,0.386802,analyst_comment; analyst_commentary; analyst_coverage; analyst_coverage_initiation; analyst_downgrade
34,2543,123,64.736842,0.041857,0.151815,0.236453,0.430562,industrial_policy; industry_analysis; industry_challenges; industry_concerns; industry_context
53,4190,154,81.052632,0.038661,0.149022,0.529289,0.43137,cryptocurrency_market_fluctuation; cryptocurrency_market_movement; cryptocurrency_price_movement; market_analysis; market_commentary
54,89,5,2.631579,0.038321,0.157452,0.14382,0.227322,credit_agreement; credit_card_promotion; credit_card_switch; credit_quality_concerns; credit_rating_change
48,333,17,8.947368,0.032125,0.150381,0.438138,0.254601,initial_public_offering; ipo_announcement; ipo_funding; ipo_impact; ipo_investment
4,3352,100,52.631579,0.026115,0.127058,0.339961,0.479516,activist_investor; alternative_investment; cryptocurrency_investment; esg_investing; hedge_fund_activity
44,13,11,5.789474,0.025011,0.031679,0.430769,0.126398,high_options_trading_volume; options_contract_availability; options_contract_update; options_trading; options_trading_activity
35,22,2,1.052632,0.023407,0.107265,0.590909,0.04166,licensing_agreement
52,454,10,5.263158,0.014499,0.103944,0.392731,0.337019,catastrophe_loss_estimate; data_security_concerns; infrastructure_disruption; insurance_claims_improvement; natural_disaster
50,1614,25,13.157895,0.006208,0.061002,0.877943,0.094832,adoption; award_recognition; conference_discussion; conference_participation; customer_win
39,721,9,4.736842,0.003563,0.053082,0.101248,0.076766,labor_cost_increase; price_drop; price_movement; price_target; price_target_increase
