cluster_id,fact_count,sample_count,percentage_of_samples,avg_attention_score,std_attention_score,avg_sentiment,std_sentiment,sample_event_types
41,3,3,1.578947,0.378716,0.130741,0.7,0.141421,artificial_intelligence_adoption; investment_in_artificial_intelligence
25,25,23,12.105263,0.376414,0.328227,-0.496,0.352681,consumer_spending_decrease; economic_downturn; market_decline; market_plunge; pc_shipments_decline
5,12,10,5.263158,0.292457,0.229751,0.15,0.597913,demand_supply_mismatch; production_challenges; production_milestone; production_miss; supplier_change
21,11,9,4.736842,0.28444,0.283828,-0.336364,0.429106,advertising_pause; company_response; contract_loss; customer_loss; outage_impact_on_clients
49,13,11,5.789474,0.282782,0.279744,-0.5,0.44893,export_restrictions; geopolitical_risk; geopolitical_tensions; tariff_impact; trade_restrictions
38,49,41,21.578947,0.27802,0.224361,0.528571,0.375119,economic_forecast; economic_outlook; investment_outlook; long_term_outlook; market_cap_projection
55,49,31,16.315789,0.255244,0.227639,0.240816,0.50706,regulatory_action; regulatory_announcement; regulatory_approval; regulatory_call; regulatory_challenges
36,26,20,10.526316,0.246622,0.261698,0.45,0.389526,asset_sale; buyout_interest; divestment; divesture; equity_raising
43,6,5,2.631579,0.23809,0.16029,0.683333,0.267187,government_incentives; government_initiative; meeting_with_government; tax_credit_extension; tax_legislation_impact
45,8,4,2.105263,0.216695,0.340447,0.1,0.772981,innovation_hub_opening; new_exchange_launch; spin_off_announcement
13,11,9,4.736842,0.209261,0.19194,-0.245455,0.484981,court_ruling; human_rights_hearing; intellectual_property_dispute; lawsuit; lawsuit_settlement
14,35,23,12.105263,0.198559,0.241577,0.274286,0.4753,acquisition_rumor; acquisition_rumors; company_breakup; company_controversy; divestiture
8,12,5,2.631579,0.195033,0.25279,-0.15,0.572276,flexible_work_arrangements; labor_agreement; labor_contract_agreement; labor_dispute; labor_negotiations
31,18,16,8.421053,0.1906,0.246669,0.483333,0.507992,after_hours_trading; bullish_trade; insider_buying; oversold_condition; record_trading_volume
57,25,24,12.631579,0.189789,0.216092,0.432,0.340259,business_model_transformation; business_restructuring; business_strategy_shift; company_transformation; consolidation
56,3,1,0.526316,0.183805,0.033553,0.6,0.141421,banking_sector_stability; banking_system_support
26,10,10,5.263158,0.182118,0.280376,0.07,0.467012,bankruptcy; debt_analysis; debt_offering; debt_origination_record; debt_refinancing
19,16,11,5.789474,0.170781,0.244,0.65625,0.217855,business_recovery; economic_recovery; market_rebound; market_recovery; recovery_potential
28,39,23,12.105263,0.168335,0.288608,0.597436,0.286882,analyst_rating; customer_loyalty_ranking; guru_rating; investment_rating; neutral_rating
30,8,5,2.631579,0.158153,0.128339,0.0875,0.658478,covid_19_impact; health_crisis_impact; pandemic_impact; pandemic_recovery; pandemic_related_decline
12,6,5,2.631579,0.158063,0.091825,0.616667,0.409946,climate_risk_disclosure; green_bond_issuance; renewable_energy_commitment; renewable_energy_initiative; sustainability_efforts
20,29,25,13.157895,0.155328,0.135137,0.555172,0.264687,adoption_expansion; benefit_expansion; business_expansion; delivery_expansion; expansion
0,75,51,26.842105,0.150391,0.209888,0.768667,0.130326,business_growth; customer_growth; growth_acceleration; growth_and_dividend; growth_and_value_opportunity
39,11,9,4.736842,0.147255,0.270575,0.227273,0.626811,labor_cost_increase; price_drop; price_movement; price_target; price_target_increase
7,11,11,5.789474,0.142149,0.098274,0.427273,0.349261,automation_adoption; digital_transformation; disruption_and_innovation; menu_innovation; technical_milestone
29,169,67,35.263158,0.137374,0.228832,0.739053,0.1602,brand_performance; brand_recognition; product_adoption; product_demand; product_description
3,18,11,5.789474,0.125789,0.12296,0.555556,0.46574,demand_surge; holiday_sales; holiday_sales_report; holiday_season_sales; new_purchase
27,40,9,4.736842,0.116958,0.24434,0.3,0.333167,index_composition; index_constituents; index_construction; index_inclusion; index_movement
9,155,76,40.0,0.116246,0.151555,0.565161,0.476356,acquisitions_and_earnings_growth; earnings_analysis; earnings_and_demand_update; earnings_and_financials; earnings_and_rating_upgrade
33,148,38,20.0,0.115506,0.260202,0.523986,0.466712,added_position; added_positions; blue_chip_classification; breakout; cloud_transition
18,17,13,6.842105,0.114525,0.108464,0.394118,0.484429,cloud_adoption; cloud_competition; cloud_computing_strategy; cloud_lag; cryptocurrency_adoption
24,93,20,10.526316,0.098306,0.220262,0.146237,0.30252,currency_headwinds; economic_commentary; economic_policy_impact; federal_reserve_announcement; federal_reserve_intervention
11,9,7,3.684211,0.09727,0.068799,0.488889,0.523757,auction; bond_offering; contract_ratification; deal_cancellation; new_deals
1,512,81,42.631579,0.096644,0.232157,0.348242,0.236257,comparable_analysis; comparative_analysis; comparison; competitive_benchmarking; competitive_comparison
16,87,15,7.894737,0.095079,0.257806,0.429885,0.354646,capital_increase_approval; capital_plan_announcement; capital_plan_approval; capital_raise_consideration; capital_return_plan
47,96,32,16.842105,0.093149,0.174246,0.2625,0.32186,market_valuation; stock_valuation; undervaluation; undervaluation_analysis; undervaluation_opportunity
48,55,12,6.315789,0.088296,0.224611,-0.030909,0.330769,initial_public_offering; ipo_announcement; ipo_impact; ipo_market_trend; ipo_partnership
23,116,41,21.578947,0.083637,0.15884,0.02069,0.530699,businessSuspension; business_delegation; business_model; business_model_analysis; business_model_description
51,675,81,42.631579,0.081732,0.169116,-0.283407,0.394957,competition; competition_analysis; competition_and_privacy_changes; competition_intensification; competition_performance
42,117,33,17.368421,0.080725,0.180923,-0.038462,0.542209,investment_and_partnership; partnership_acquisition; partnership_and_certifications; partnership_and_competition; partnership_and_expansion
59,1222,81,42.631579,0.076719,0.234369,0.047381,0.334276,etf_analysis; etf_comparison; etf_composition; etf_description; etf_focus
6,496,60,31.578947,0.076383,0.205117,0.340323,0.199867,business_update_and_dividend_growth; dividend_adjustment; dividend_analysis; dividend_announcement; dividend_announcement_and_share_repurchase
2,1217,112,58.947368,0.074385,0.192537,0.668036,0.160235,blockchain_partnership; collaboration; industry_partnership; investment_partnership; partnership
10,1170,68,35.789474,0.059728,0.205334,0.475897,0.269156,analyst_comment; analyst_commentary; analyst_coverage; analyst_coverage_initiation; analyst_downgrade
32,648,91,47.894737,0.059366,0.174408,0.639043,0.237015,cyclical_stock_analysis; former_penny_stocks; growth_stock_evaluation; growth_stock_recommendation; investor_sentiment
46,58,12,6.315789,0.05812,0.17556,0.65,0.215958,profit_margin_increase; profitability_outlook; revenue_forecast; revenue_growth; revenue_growth_comparison
15,512,64,33.684211,0.054875,0.158235,0.561328,0.194927,acquisition; acquisition_analysis; acquisition_and_dividend; acquisition_and_expansion; acquisition_and_partnership
37,318,46,24.210526,0.054146,0.179578,0.346541,0.291338,competitive_jab; congressional_hearing; crisis_management; criticism; election_aftermath
40,290,32,16.842105,0.052516,0.187907,-0.275517,0.40393,asset_management_update; asset_under_management_update; assets_under_management_update; capital_buffer_update; customer_base_update
17,1373,135,71.052632,0.052116,0.144488,0.373809,0.398477,acquisition_and_earnings_announcement; earnings_and_sales_report; earnings_announcement; earnings_announcement_and_acquisition; earnings_announcement_and_analyst_upgrade
22,273,27,14.210526,0.041158,0.146726,0.500733,0.264228,ceo_appointment; executive_appointment; executive_background; executive_change; executive_hire
34,2480,103,54.210526,0.036704,0.14404,0.230927,0.428961,industrial_policy; industry_analysis; industry_challenges; industry_context; industry_development
4,2058,92,48.421053,0.035886,0.148383,0.077259,0.433111,activist_investor; alternative_investment; competitive_investment; cryptocurrency_investment; esg_investing
58,50,10,5.263158,0.035517,0.143992,0.586,0.309845,catastrophe_loss_report; customer_satisfaction_report; industry_loss_report; market_share_report; report_release
53,4038,131,68.947368,0.034846,0.143035,0.549931,0.400826,cryptocurrency_market_fluctuation; cryptocurrency_market_movement; cryptocurrency_price_movement; market_analysis; market_commentary
52,160,8,4.210526,0.032566,0.152999,0.02375,0.313546,catastrophe_loss_estimate; data_security_concerns; insurance_claims_improvement; natural_disaster; natural_disaster_impact
54,85,3,1.578947,0.029181,0.154858,0.171765,0.14999,credit_agreement; credit_card_switch; credit_quality_concerns; credit_rating_update
44,12,10,5.263158,0.022505,0.031982,0.425,0.129904,high_options_trading_volume; options_contract_availability; options_contract_update; options_trading; options_trading_activity
50,1544,21,11.052632,0.005216,0.053925,0.894171,0.055916,adoption; award_recognition; conference_discussion; conference_participation; customer_win
35,1,1,0.526316,0.0,0.0,0.4,0.0,licensing_agreement
